{
  "format": "axiom-platform-evidence-index-v1", "formatVersion": 1, "authority": "G0_WIRING_ONLY", "sourceCommit": "aaaaaaaaaaaaaaaaaaaaaaaaaaaaaaaaaaaaaaaa", "corpusSha256": "cccccccccccccccccccccccccccccccccccccccccccccccccccccccccccccccc", "runnerVersion": "0.1.0", "runtimeVersion": "0.1.0",
  "records": [], "missingSubjects": ["web"], "validationIssues": []
}
